{
    "version": "1.0",
    "mode": "notify",
    "template": "notification",
    "position": "bottom_right",
    "duration_ms": 80000,
    "content": {
        "severity": "success",
        "title": "Backup completed",
        "blocks": [
            {
                "text": "128 files, 2.4 GB, 03:21.",
                "type": "paragraph"
            },
            {
                "type": "progress",
                "title": "Completion",
                "value": 100
            }
        ]
    }
}
